customer_code,customer_name,tax_code,address,province_id,customer_tier,is_active,created_at,updated_at
KH-00501,CÔNG TY CỔ PHẦN VĨNH PHÁT,186437422,"Tố Hữu, TDP Trung Phong, Xã Lưu Vệ, Tỉnh Thanh Hóa",52,STANDARD,True,2026-05-26 16:47:27.716285+07:00,2026-05-26 16:47:27.716285+07:00
KH-00502,CỬA HÀNG XE ĐẠP BÌNH MINH,204074148,"Tương Chúc, Xã Nam Phù, Thành phố Hà Nội",11,STANDARD,True,2026-05-26 16:47:27.716285+07:00,2026-05-26 16:47:27.716285+07:00
KH-00503,DOANH NGHIỆP TW PHÚ THỊNH,170794199,"Phố Vồi, Xã Thường Tín, Thành phố Hà Nội",11,STANDARD,True,2026-05-26 16:47:27.716285+07:00,2026-05-26 16:47:27.716285+07:00
KH-00504,CÔNG TY CỔ PHẦN THƯƠNG MẠI TÂY BẮC,173118358,"Xã Phúc Sơn, TP Hà Nội",11,STANDARD,True,2026-05-26 16:47:27.716285+07:00,2026-05-26 16:47:27.716285+07:00
KH-00505,CÔNG TY CỔ PHẦN TÚ ANH,215542711,"Khối 5, Xã Quỳnh Lưu, Nghệ An",29,STANDARD,True,2026-05-26 16:47:27.716285+07:00,2026-05-26 16:47:27.716285+07:00
KH-00506,CÔNG TY TNHH THANH BÌNH,293390264,"phố Nguyễn Thái Học, Xã Đan Phượng, Thành phố Hà Nội",11,STANDARD,True,2026-05-26 16:47:27.716285+07:00,2026-05-26 16:47:27.716285+07:00
KH-00507,CỬA HÀNG XE ĐẠP BÌNH MINH,205389693,"Xã Vĩnh Hưng, Phú Thọ",33,STANDARD,True,2026-05-26 16:47:27.716285+07:00,2026-05-26 16:47:27.716285+07:00
KH-00508,CÔNG TY CỔ PHẦN VĨNH PHÁT,232320227,"Xã Hà Đông, TP Hải Phòng",46,STANDARD,True,2026-05-26 16:47:27.716285+07:00,2026-05-26 16:47:27.716285+07:00
KH-00509,CÔNG TY TNHH THƯƠNG MẠI BÌNH MINH,108925009,"Chợ Thứa, Xã Lương Tài, Tỉnh Bắc Ninh",3,STANDARD,True,2026-05-26 16:47:27.716285+07:00,2026-05-26 16:47:27.716285+07:00
KH-00510,CỬA HÀNG XE ĐẠP NGỌC ANH,221409129,"Phố mới - TT Hồ, Phường Thuận Thành, Bắc Ninh",3,STANDARD,True,2026-05-26 16:47:27.716285+07:00,2026-05-26 16:47:27.716285+07:00
KH-00511,CÔNG TY TNHH BÌNH MINH,204530740,"đường Nguyễn Huệ, Phường Lào Cai, Tỉnh Lào Cai",24,STANDARD,True,2026-05-26 16:47:27.716285+07:00,2026-05-26 16:47:27.716285+07:00
KH-00512,CÔNG TY TNHH ĐẠI DƯƠNG,262139034,"Khu 12, Xã Lâm Thao, Tỉnh Phú Thọ",33,STANDARD,True,2026-05-26 16:47:27.716285+07:00,2026-05-26 16:47:27.716285+07:00
KH-00513,CÔNG TY CỔ PHẦN THƯƠNG MẠI ĐÔNG NAM,181076657,"TDP Phố Huyện, Xã Quốc Oai, Thành phố Hà Nội",11,STANDARD,True,2026-05-26 16:47:27.716285+07:00,2026-05-26 16:47:27.716285+07:00
KH-00514,CỬA HÀNG XE ĐẠP HÙNG CƯỜNG,291784533,"TDP phố Săn, thị trấn Liên Quan, huyện Thạch Thất, Hà Nội",11,STANDARD,True,2026-05-26 16:47:27.716285+07:00,2026-05-26 16:47:27.716285+07:00
KH-00515,CÔNG TY CỔ PHẦN THƯƠNG MẠI SƠN HÀ,174783130,"109C, khu 2, Thị trấn Cẩm Giang(Hết hiệu lực), TP Hải Phòng",46,STANDARD,True,2026-05-26 16:47:27.716285+07:00,2026-05-26 16:47:27.716285+07:00
KH-00516,CÔNG TY TNHH SÁN LẠP,230936283,"Xã Tiên Tiến, Tỉnh Hưng Yên",14,STANDARD,True,2026-05-26 16:47:27.716285+07:00,2026-05-26 16:47:27.716285+07:00
KH-00517,CỬA HÀNG XE ĐẠP PHÚ THỊNH,221030390,"Xã Quang Hưng, Hưng Yên",14,STANDARD,True,2026-05-26 16:47:27.716285+07:00,2026-05-26 16:47:27.716285+07:00
KH-00518,CÔNG TY TNHH THƯƠNG MẠI VĨNH PHÁT,183952775,"Đội 5, Thôn Hạ Tân, Xã Nghĩa Trụ, Tỉnh Hưng Yên",14,STANDARD,True,2026-05-26 16:47:27.716285+07:00,2026-05-26 16:47:27.716285+07:00
KH-00519,CÔNG TY CỔ PHẦN XUÂN MAI,257785403,"TT Bô Thời, Hồng Tiến, Xã Việt Tiến, Hưng Yên",14,STANDARD,True,2026-05-26 16:47:27.716285+07:00,2026-05-26 16:47:27.716285+07:00
KH-00520,CÔNG TY TNHH TÂY BẮC,274088653,"phố Tường Thụy 2, Phường Duy Tiên, Ninh Bình",30,STANDARD,True,2026-05-26 16:47:27.716285+07:00,2026-05-26 16:47:27.716285+07:00
KH-00521,CỬA HÀNG XE ĐẠP KHẢI HOÀN,291633835,"Xã Bình Lục, Tỉnh Ninh Bình",30,STANDARD,True,2026-05-26 16:47:27.716285+07:00,2026-05-26 16:47:27.716285+07:00
KH-00522,CÔNG TY TNHH HÙNG CƯỜNG,216017109,"TDP Bình Tiến, Xã Bình Mỹ, Tỉnh Ninh Bình",30,STANDARD,True,2026-05-26 16:47:27.716285+07:00,2026-05-26 16:47:27.716285+07:00
KH-00523,HỘ KINH DOANH KHẢI HOÀN,197470458,"Lạc long Quân, Phường Bưởi(Hết hiệu lực), Thành phố Hà Nội",11,STANDARD,True,2026-05-26 16:47:27.716285+07:00,2026-05-26 16:47:27.716285+07:00
KH-00524,CÔNG TY CỔ PHẦN THƯƠNG MẠI TRÍ ĐỨC,198942489,"trương xá, Xã Nghĩa Dân, Tỉnh Hưng Yên",14,STANDARD,True,2026-05-26 16:47:27.716285+07:00,2026-05-26 16:47:27.716285+07:00
KH-00525,CỬA HÀNG XE ĐẠP SÁN LẠP,234141559,"Điện Biên, Phường Phố Hiến, Tỉnh Hưng Yên",14,STANDARD,True,2026-05-26 16:47:27.716285+07:00,2026-05-26 16:47:27.716285+07:00
KH-00526,CÔNG TY CỔ PHẦN NAM TIẾN,180153456,"phố số 6, Xã Thái Thụy, Hưng Yên",14,STANDARD,True,2026-05-26 16:47:27.716285+07:00,2026-05-26 16:47:27.716285+07:00
KH-00527,CÔNG TY CỔ PHẦN THƯƠNG MẠI HOÀ BÌNH,166090037,"đường mương Đan Hoài, thôn 6, Xã Sơn Đồng, TP Hà Nội",11,STANDARD,True,2026-05-26 16:47:27.716285+07:00,2026-05-26 16:47:27.716285+07:00
KH-00528,CÔNG TY CỔ PHẦN VẠN LỢI,298434475,"TDP Nếnh, Phường Nếnh, tỉnh Bắc Ninh, Việt Nam",3,STANDARD,True,2026-05-26 16:47:27.716285+07:00,2026-05-26 16:47:27.716285+07:00
KH-00529,CÔNG TY CỔ PHẦN THƯƠNG MẠI THIÊN AN,194440034,"Khối 6, Thị trấn Tân Kỳ, Huyện Tân Kỳ, Nghệ An",29,STANDARD,True,2026-05-26 16:47:27.716285+07:00,2026-05-26 16:47:27.716285+07:00
KH-00530,DOANH NGHIỆP TW TÂY BẮC,296781744,"Xã Quảng Oai, Thành phố Hà Nội",11,STANDARD,True,2026-05-26 16:47:27.716285+07:00,2026-05-26 16:47:27.716285+07:00
KH-00531,CÔNG TY TNHH THƯƠNG MẠI VẠN LỢI,153446491,"Xã Vật Lại, TP Hà Nội",11,STANDARD,True,2026-05-26 16:47:27.716285+07:00,2026-05-26 16:47:27.716285+07:00
KH-00532,CÔNG TY TNHH THƯƠNG MẠI MẶT TRỜI,161819698,"Phường Sơn Tây, TP Hà Nội",11,STANDARD,True,2026-05-26 16:47:27.716285+07:00,2026-05-26 16:47:27.716285+07:00
KH-00533,CÔNG TY TNHH YÊN BÌNH,251387989,"Khu phố II, Xã Bình Nguyên, Tỉnh Phú Thọ",33,STANDARD,True,2026-05-26 16:47:27.716285+07:00,2026-05-26 16:47:27.716285+07:00
KH-00534,DOANH NGHIỆP TW AN PHÁT,171317819,"Phố Me, Xã Tam Dương, Tỉnh Phú Thọ",33,STANDARD,True,2026-05-26 16:47:27.716285+07:00,2026-05-26 16:47:27.716285+07:00
KH-00535,CỬA HÀNG XE ĐẠP QUANG VINH,239051064,"đường Nguyễn Tất Thành, Phường Vĩnh Phúc, Phú Thọ",33,STANDARD,True,2026-05-26 16:47:27.716285+07:00,2026-05-26 16:47:27.716285+07:00
KH-00536,CỬA HÀNG XE ĐẠP LONG PHÚ,260443448,"tòa nhà CT1 Khu Nhà Bắc Linh Đàm, Phường Định Công, TP Hà Nội",11,STANDARD,True,2026-05-26 16:47:27.716285+07:00,2026-05-26 16:47:27.716285+07:00
KH-00537,CÔNG TY CỔ PHẦN ĐÔNG NAM,194950902,"Thị trấn Đồng Tâm, Huyện Chợ mới, Bắc Kạn",2,STANDARD,True,2026-05-26 16:47:27.716285+07:00,2026-05-26 16:47:27.716285+07:00
KH-00538,HỘ KINH DOANH PHÚC AN,247587793,"Xã Nguyên Bình, Cao Bằng",4,STANDARD,True,2026-05-26 16:47:27.716285+07:00,2026-05-26 16:47:27.716285+07:00
KH-00539,CỬA HÀNG XE ĐẠP CHI THÀNH,204142388,"Pháp, Xã Điềm Thụy, Thái Nguyên",54,STANDARD,True,2026-05-26 16:47:27.716285+07:00,2026-05-26 16:47:27.716285+07:00
KH-00540,CÔNG TY TNHH NGỌC ANH,224039499,"Đường vành đai, Thôn Thượng, Xã Sơn Đồng, TP Hà Nội",11,STANDARD,True,2026-05-26 16:47:27.716285+07:00,2026-05-26 16:47:27.716285+07:00
KH-00541,HỘ KINH DOANH SÁN LẠP,110864198,"Khu du lịch Xuân Thiều, Phường Hải Vân, TP Đà Nẵng",47,STANDARD,True,2026-05-26 16:47:27.716285+07:00,2026-05-26 16:47:27.716285+07:00
KH-00542,CÔNG TY TNHH THƯƠNG MẠI NAM TIẾN,192892165,"Xã Chi Lăng, Lạng Sơn",26,STANDARD,True,2026-05-26 16:47:27.716285+07:00,2026-05-26 16:47:27.716285+07:00
KH-00543,CÔNG TY CỔ PHẦN SƠN HÀ,241076147,"đường Cầu Diễn, Phường Xuân Phương, Thành phố Hà Nội",11,STANDARD,True,2026-05-26 16:47:27.716285+07:00,2026-05-26 16:47:27.716285+07:00
KH-00544,DOANH NGHIỆP TW VIỆT ANH,240687273,"tổ 3, Phường Kiến Hưng, TP Hà Nội",11,STANDARD,True,2026-05-26 16:47:27.716285+07:00,2026-05-26 16:47:27.716285+07:00
KH-00545,CÔNG TY CỔ PHẦN AN PHÁT,136695790,"Tại nhà số 461, tổ 15, Phường Hòa Bình, Phú Thọ",33,STANDARD,True,2026-05-26 16:47:27.716285+07:00,2026-05-26 16:47:27.716285+07:00
KH-00546,CÔNG TY CỔ PHẦN SÁN LẠP,117966807,"TDP Thượng Giang, Xã Lệ Thủy, Quảng Trị",40,STANDARD,True,2026-05-26 16:47:27.716285+07:00,2026-05-26 16:47:27.716285+07:00
KH-00547,DOANH NGHIỆP TW THANH BÌNH,114803989,"Xã Mộ Đức, Quảng Ngãi",37,STANDARD,True,2026-05-26 16:47:27.716285+07:00,2026-05-26 16:47:27.716285+07:00
KH-00548,CÔNG TY TNHH KHẢI HOÀN,217754474,"Trần Hưng Đạo, KP3, Phường Quảng Trị, Quảng Trị",40,STANDARD,True,2026-05-26 16:47:27.716285+07:00,2026-05-26 16:47:27.716285+07:00
KH-00549,CỬA HÀNG XE ĐẠP TÚ ANH,241840289,"K8 thị trấn Hạ Hoà, Xã Hạ Hòa, Phú Thọ",33,STANDARD,True,2026-05-26 16:47:27.716285+07:00,2026-05-26 16:47:27.716285+07:00
KH-00550,CÔNG TY TNHH ĐÔNG NAM,215180645,"Khu Tân Tiến, Xã Cẩm Khê, Tỉnh Phú Thọ",33,STANDARD,True,2026-05-26 16:47:27.716285+07:00,2026-05-26 16:47:27.716285+07:00
KH-00551,CÔNG TY CỔ PHẦN THƯƠNG MẠI SÁN LẠP,131569872,"phố Phú Bình, Phường Phong Châu, Phú Thọ",33,STANDARD,True,2026-05-26 16:47:27.716285+07:00,2026-05-26 16:47:27.716285+07:00
KH-00552,CỬA HÀNG XE ĐẠP YÊN BÌNH,252432585,"Khu 7, Xã Phùng Nguyên, Phú Thọ",33,STANDARD,True,2026-05-26 16:47:27.716285+07:00,2026-05-26 16:47:27.716285+07:00
KH-00553,CÔNG TY CỔ PHẦN SƠN HÀ,243677870,"Tây Sơn, Phường Đống Đa, TP Hà Nội",11,STANDARD,True,2026-05-26 16:47:27.716285+07:00,2026-05-26 16:47:27.716285+07:00
KH-00554,CÔNG TY CỔ PHẦN THƯƠNG MẠI SÁN LẠP,132303358,"TDP Phượng Bãi, Phường Chương Mỹ, Thành phố Hà Nội",11,STANDARD,True,2026-05-26 16:47:27.716285+07:00,2026-05-26 16:47:27.716285+07:00
KH-00555,CỬA HÀNG XE ĐẠP TRƯỜNG THỊNH,240177337,"Chợ Lương, Phường Đồng Văn, Ninh Bình",30,STANDARD,True,2026-05-26 16:47:27.716285+07:00,2026-05-26 16:47:27.716285+07:00
KH-00556,DOANH NGHIỆP TW THIÊN AN,297200694,"XÓM GIAO THÔNG, Xã An Khánh, Thành phố Hà Nội",11,STANDARD,True,2026-05-26 16:47:27.716285+07:00,2026-05-26 16:47:27.716285+07:00
KH-00557,CÔNG TY TNHH THƯƠNG MẠI MINH PHƯƠNG,120842089,"Phố Bà Triệu, Phường Cửa Nam, TP Hà Nội",11,STANDARD,True,2026-05-26 16:47:27.716285+07:00,2026-05-26 16:47:27.716285+07:00
KH-00558,CÔNG TY CỔ PHẦN THƯƠNG MẠI SƠN HÀ,179084489,"phố Xã Đàn, Phường Văn Miếu - Quốc Tử Giám, TP Hà Nội",11,STANDARD,True,2026-05-26 16:47:27.716285+07:00,2026-05-26 16:47:27.716285+07:00
KH-00559,CÔNG TY TNHH THƯƠNG MẠI TÂY BẮC,170061850,"Trần Hưng Đạo, Phường Sầm Sơn, Thanh Hóa",52,STANDARD,True,2026-05-26 16:47:27.716285+07:00,2026-05-26 16:47:27.716285+07:00
KH-00560,CÔNG TY CỔ PHẦN THƯƠNG MẠI NGỌC ANH,125926109,"Xã Vĩnh Hải(Hết hiệu lực), Thành phố Hải Phòng",20,STANDARD,True,2026-05-26 16:47:27.716285+07:00,2026-05-26 16:47:27.716285+07:00
KH-00561,CÔNG TY TNHH THƯƠNG MẠI VĨNH PHÁT,185362399,"Thửa 110, tờ bản đồ 71, tổ dân phố Hương, Phường Tân An, Bắc Ninh",3,STANDARD,True,2026-05-26 16:47:27.716285+07:00,2026-05-26 16:47:27.716285+07:00
KH-00562,CÔNG TY CỔ PHẦN THƯƠNG MẠI NAM TIẾN,192433335,"Quang Trung, Phường Hà Đông, Thành phố Hà Nội",11,STANDARD,True,2026-05-26 16:47:27.716285+07:00,2026-05-26 16:47:27.716285+07:00
KH-00563,HỘ KINH DOANH YÊN BÌNH,236481534,"đường Phạm Văn Đồng, Phường Đông Ngạc, Thành phố Hà Nội",11,STANDARD,True,2026-05-26 16:47:27.716285+07:00,2026-05-26 16:47:27.716285+07:00
KH-00564,CỬA HÀNG XE ĐẠP SÁN LẠP,237058486,"Xã Quang Lịch, Huyện Kiến Xương, Thái Bình",53,STANDARD,True,2026-05-26 16:47:27.716285+07:00,2026-05-26 16:47:27.716285+07:00
KH-00565,CÔNG TY CỔ PHẦN THƯƠNG MẠI KHẢI HOÀN,111558627,"Xã Kiến Hải, Thành phố Hải Phòng",20,STANDARD,True,2026-05-26 16:47:27.716285+07:00,2026-05-26 16:47:27.716285+07:00
KH-00566,DOANH NGHIỆP TW PHÚ THỊNH,128093953,"KP Tân Hoà, Xã Vĩnh Bảo, Thành phố Hải Phòng",20,STANDARD,True,2026-05-26 16:47:27.716285+07:00,2026-05-26 16:47:27.716285+07:00
KH-00567,CÔNG TY CỔ PHẦN THƯƠNG MẠI SƠN HÀ,197718949,"Phường An Phong, TP Hải Phòng",46,STANDARD,True,2026-05-26 16:47:27.716285+07:00,2026-05-26 16:47:27.716285+07:00
KH-00568,DOANH NGHIỆP TW NGỌC ANH,147661615,"Tô Hiệu, Phường Lê Chân, TP Hải Phòng",46,STANDARD,True,2026-05-26 16:47:27.716285+07:00,2026-05-26 16:47:27.716285+07:00
KH-00569,CÔNG TY TNHH VẠN LỢI,251887557,"Hòa Vang 3, Xã Hưng Lộc, TP Huế",43,STANDARD,True,2026-05-26 16:47:27.716285+07:00,2026-05-26 16:47:27.716285+07:00
KH-00570,HỘ KINH DOANH TOÀN THẮNG,224741140,"(Tầng 1+2) Lê Lợi, Phường Gia Viên, Thành phố Hải Phòng",20,STANDARD,True,2026-05-26 16:47:27.716285+07:00,2026-05-26 16:47:27.716285+07:00
KH-00571,CỬA HÀNG XE ĐẠP THUỶ TIÊN,273679758,"đường chiến thắng Sông Lô, tổ 2, Phường Minh Xuân, Tuyên Quang",58,STANDARD,True,2026-05-26 16:47:27.716285+07:00,2026-05-26 16:47:27.716285+07:00
KH-00572,CÔNG TY CỔ PHẦN THƯƠNG MẠI VIỆT ANH,150242956,"Đông Hải 1, Phường Cẩm Phả, Tỉnh Quảng Ninh",38,STANDARD,True,2026-05-26 16:47:27.716285+07:00,2026-05-26 16:47:27.716285+07:00
KH-00573,DOANH NGHIỆP TW THANH BÌNH,164007647,"SN: 35, tổ 1, khu 4A, Phường Cẩm Phả, Tỉnh Quảng Ninh",38,STANDARD,True,2026-05-26 16:47:27.716285+07:00,2026-05-26 16:47:27.716285+07:00
KH-00574,CỬA HÀNG XE ĐẠP LONG PHÚ,288617546,"Số:466,tổ 109,khu 8 B, Phường Cửa Ông, Quảng Ninh",38,STANDARD,True,2026-05-26 16:47:27.716285+07:00,2026-05-26 16:47:27.716285+07:00
KH-00575,CÔNG TY CỔ PHẦN THƯƠNG MẠI NAM TIẾN,120291779,"Vườn Trầu 022, Phường Móng Cái 1, Tỉnh Quảng Ninh",38,STANDARD,True,2026-05-26 16:47:27.716285+07:00,2026-05-26 16:47:27.716285+07:00
KH-00576,DOANH NGHIỆP TW THIÊN AN,236945584,"khu Trới 10, phường Hoành Bồ, TP. Hạ Long, Quảng Ninh",38,STANDARD,True,2026-05-26 16:47:27.716285+07:00,2026-05-26 16:47:27.716285+07:00
KH-00577,CÔNG TY CỔ PHẦN THƯƠNG MẠI ĐẠI DƯƠNG,165696049,"Cổng phụ trường THPT Hùng Vương, Xã Như Quỳnh, Tỉnh Hưng Yên",14,STANDARD,True,2026-05-26 16:47:27.716285+07:00,2026-05-26 16:47:27.716285+07:00
KH-00578,DOANH NGHIỆP TW NGỌC ANH,134709777,"thôn Thụy Khuê, Xã Quốc Oai, TP Hà Nội",11,STANDARD,True,2026-05-26 16:47:27.716285+07:00,2026-05-26 16:47:27.716285+07:00
KH-00579,CÔNG TY TNHH THƯƠNG MẠI XÂY DỰNG,183360116,"Tổ 1, khu 3A, Phường Cẩm Phả, Quảng Ninh",38,STANDARD,True,2026-05-26 16:47:27.716285+07:00,2026-05-26 16:47:27.716285+07:00
KH-00580,CÔNG TY CỔ PHẦN THƯƠNG MẠI LONG PHÚ,169985646,"Mẹ Thứ, Phường Hòa Xuân, Thành phố Đà Nẵng",70,STANDARD,True,2026-05-26 16:47:27.716285+07:00,2026-05-26 16:47:27.716285+07:00
KH-00581,DOANH NGHIỆP TW SƠN HÀ,285787156,"Phường Điện Biên Phủ, Tỉnh Điện Biên",69,STANDARD,True,2026-05-26 16:47:27.716285+07:00,2026-05-26 16:47:27.716285+07:00
KH-00582,HỘ KINH DOANH LONG PHÚ,226747813,"Tổ 2, Phường Mường Thanh, Điện Biên",69,STANDARD,True,2026-05-26 16:47:27.716285+07:00,2026-05-26 16:47:27.716285+07:00
KH-00583,CÔNG TY TNHH THƯƠNG MẠI THANH BÌNH,135037784,"Ngô Quyền, Phường An Hải, Thành phố Đà Nẵng",70,STANDARD,True,2026-05-26 16:47:27.716285+07:00,2026-05-26 16:47:27.716285+07:00
KH-00584,CÔNG TY TNHH CHI THÀNH,204828533,"phố Trương Công Giai, Phường Cầu Giấy, TP Hà Nội",11,STANDARD,True,2026-05-26 16:47:27.716285+07:00,2026-05-26 16:47:27.716285+07:00
KH-00585,CÔNG TY TNHH TÂY BẮC,270125357,"Đồng Mon Đại Lý Việt Hưng, Phường Bình Thuận, Tuyên Quang",58,STANDARD,True,2026-05-26 16:47:27.716285+07:00,2026-05-26 16:47:27.716285+07:00
KH-00586,CÔNG TY CỔ PHẦN THƯƠNG MẠI MINH PHƯƠNG,127211976,"Khu 22, Xã Tu Vũ, Phú Thọ",33,STANDARD,True,2026-05-26 16:47:27.716285+07:00,2026-05-26 16:47:27.716285+07:00
KH-00587,DOANH NGHIỆP TW AN PHÁT,173911310,"Minh Cường, Xã Phú Xuyên, Thành phố Hà Nội",11,STANDARD,True,2026-05-26 16:47:27.716285+07:00,2026-05-26 16:47:27.716285+07:00
KH-00588,CÔNG TY CỔ PHẦN TÂY BẮC,279444263,"Xã Phú Xuyên, Thành phố Hà Nội",11,STANDARD,True,2026-05-26 16:47:27.716285+07:00,2026-05-26 16:47:27.716285+07:00
KH-00589,DOANH NGHIỆP TW KHẢI HOÀN,149513186,"đường Louis II, KĐT Louis City, Phường Đại Mỗ, TP Hà Nội",11,STANDARD,True,2026-05-26 16:47:27.716285+07:00,2026-05-26 16:47:27.716285+07:00
KH-00590,CÔNG TY TNHH TOÀN THẮNG,241210122,"Khu công nghiệp Lễ Môn, Phường Quảng Phú, Thanh Hóa",52,STANDARD,True,2026-05-26 16:47:27.716285+07:00,2026-05-26 16:47:27.716285+07:00
KH-00591,CÔNG TY TNHH THƯƠNG MẠI KHẢI HOÀN,119249220,"TTTM Mandarin Garden 2, Số 99 Tân Mai, Phường Tương Mai, TP Hà Nội",11,STANDARD,True,2026-05-26 16:47:27.716285+07:00,2026-05-26 16:47:27.716285+07:00
KH-00592,CỬA HÀNG XE ĐẠP SÁN LẠP,238891143,"Phường Hội An Đông, TP Đà Nẵng",47,STANDARD,True,2026-05-26 16:47:27.716285+07:00,2026-05-26 16:47:27.716285+07:00
KH-00593,CÔNG TY CỔ PHẦN NGỌC ANH,122197125,"Km 9, đường Võ Văn Kiệt, Xã Quang Minh, TP Hà Nội",11,STANDARD,True,2026-05-26 16:47:27.716285+07:00,2026-05-26 16:47:27.716285+07:00
KH-00594,DOANH NGHIỆP TW LONG PHÚ,246803444,"Khối 4, Xã Yên Thành, Tỉnh Nghệ An, Việt Nam",29,STANDARD,True,2026-05-26 16:47:27.716285+07:00,2026-05-26 16:47:27.716285+07:00
KH-00595,CÔNG TY CỔ PHẦN THƯƠNG MẠI YÊN BÌNH,152411241,"Đường Trần Phú, Tổ 21, Phường Hà Giang 2, Tuyên Quang",58,STANDARD,True,2026-05-26 16:47:27.716285+07:00,2026-05-26 16:47:27.716285+07:00
KH-00596,DOANH NGHIỆP TW THUỶ TIÊN,273804658,"KDC mới, Xã Nam An Phụ, TP Hải Phòng",46,STANDARD,True,2026-05-26 16:47:27.716285+07:00,2026-05-26 16:47:27.716285+07:00
KH-00597,CÔNG TY TNHH THƯƠNG MẠI PHÚ THỊNH,122680125,"Đại Tân, Phường Trần Nhân Tông, TP Hải Phòng",46,STANDARD,True,2026-05-26 16:47:27.716285+07:00,2026-05-26 16:47:27.716285+07:00
KH-00598,DOANH NGHIỆP TW SƠN HÀ,279652439,"Phao Sơn, Phường Chí Linh, Thành phố Hải Phòng",20,STANDARD,True,2026-05-26 16:47:27.716285+07:00,2026-05-26 16:47:27.716285+07:00
KH-00599,CÔNG TY CỔ PHẦN XÂY DỰNG,126170961,"Trần Đăng Ninh, Phường Nam Định, Tỉnh Ninh Bình",30,STANDARD,True,2026-05-26 16:47:27.716285+07:00,2026-05-26 16:47:27.716285+07:00
KH-00600,CỬA HÀNG XE ĐẠP TOÀN THẮNG,294118067,"tổ 5, Xã Phụ Dực, Hưng Yên",14,STANDARD,True,2026-05-26 16:47:27.716285+07:00,2026-05-26 16:47:27.716285+07:00
KH-00601,HỘ KINH DOANH PHÚ THỊNH,191407386,"Lê Hồng Phong, Phường Hà Đông, Thành phố Hà Nội",11,STANDARD,True,2026-05-26 16:47:27.716285+07:00,2026-05-26 16:47:27.716285+07:00
KH-00602,CÔNG TY TNHH THƯƠNG MẠI THIÊN AN,141472612,"Xã Trần Phú, Thành phố Hà Nội, Việt Nam",11,STANDARD,True,2026-05-26 16:47:27.716285+07:00,2026-05-26 16:47:27.716285+07:00
KH-00603,CÔNG TY CỔ PHẦN QUANG VINH,191739127,"Khối Thanh Chiếm, Phường Hội An Tây, Thành phố Đà Nẵng",70,STANDARD,True,2026-05-26 16:47:27.716285+07:00,2026-05-26 16:47:27.716285+07:00
KH-00604,CÔNG TY CỔ PHẦN THƯƠNG MẠI PHÚC AN,197428634,"Phan Châu Trinh, Phường Hương Trà, Thành phố Đà Nẵng",70,STANDARD,True,2026-05-26 16:47:27.716285+07:00,2026-05-26 16:47:27.716285+07:00
KH-00605,CÔNG TY CỔ PHẦN VĨNH PHÁT,144322845,"Tổ dân phố Lê Duẩn, Phường Kiến An, TP Hải Phòng",46,STANDARD,True,2026-05-26 16:47:27.716285+07:00,2026-05-26 16:47:27.716285+07:00
KH-00606,CỬA HÀNG XE ĐẠP BÌNH MINH,290083932,"Đức Nghiêm, Xã Hoàng Vân, Tỉnh Bắc Ninh",3,STANDARD,True,2026-05-26 16:47:27.716285+07:00,2026-05-26 16:47:27.716285+07:00
KH-00607,CÔNG TY TNHH TÚ ANH,249735697,"Khối 3, Xã Đô Lương, Nghệ An",29,STANDARD,True,2026-05-26 16:47:27.716285+07:00,2026-05-26 16:47:27.716285+07:00
KH-00608,CÔNG TY TNHH THƯƠNG MẠI TÚ ANH,194612630,"TDP 3, Xã Hoàn Lão, Quảng Trị",40,STANDARD,True,2026-05-26 16:47:27.716285+07:00,2026-05-26 16:47:27.716285+07:00
KH-00609,DOANH NGHIỆP TW NGỌC ANH,139564642,"Đội 3, thôn Dị Chế, , Tỉnh Hưng Yên",14,STANDARD,True,2026-05-26 16:47:27.716285+07:00,2026-05-26 16:47:27.716285+07:00
KH-00610,DOANH NGHIỆP TW HÙNG CƯỜNG,119129914,"Xã Nam Thái Ninh, Tỉnh Hưng Yên",14,STANDARD,True,2026-05-26 16:47:27.716285+07:00,2026-05-26 16:47:27.716285+07:00
KH-00611,CÔNG TY TNHH VIỆT ANH,253321194,"Xã Đồng Tiến, Huyện Quỳnh Phụ, Thái Bình",53,STANDARD,True,2026-05-26 16:47:27.716285+07:00,2026-05-26 16:47:27.716285+07:00
KH-00612,DOANH NGHIỆP TW XÂY DỰNG,255039901,"Phường Bạch Đằng, TP Hải Phòng",46,STANDARD,True,2026-05-26 16:47:27.716285+07:00,2026-05-26 16:47:27.716285+07:00
KH-00613,DOANH NGHIỆP TW HÙNG CƯỜNG,156713920,"Phường Hiệp Hòa, Quảng Ninh",38,STANDARD,True,2026-05-26 16:47:27.716285+07:00,2026-05-26 16:47:27.716285+07:00
KH-00614,CỬA HÀNG XE ĐẠP NAM TIẾN,229201634,"Khu 7, Đặc khu Vân Đồn, Quảng Ninh",38,STANDARD,True,2026-05-26 16:47:27.716285+07:00,2026-05-26 16:47:27.716285+07:00
KH-00615,CÔNG TY CỔ PHẦN THƯƠNG MẠI QUANG VINH,139299647,"Thị tứ Đồng Gia, Xã Kim Thành, Thành phố Hải Phòng",20,STANDARD,True,2026-05-26 16:47:27.716285+07:00,2026-05-26 16:47:27.716285+07:00
KH-00616,CÔNG TY CỔ PHẦN TRÍ ĐỨC,105352983,"Ngõ 19, đường Tô Ngọc Vân, Phường Tây Hồ, TP Hà Nội",11,STANDARD,True,2026-05-26 16:47:27.716285+07:00,2026-05-26 16:47:27.716285+07:00
KH-00617,CÔNG TY CỔ PHẦN ĐẠI LỢI,147277498,"đường Nguyễn Văn Linh, Phường Phúc Lợi, TP Hà Nội",11,STANDARD,True,2026-05-26 16:47:27.716285+07:00,2026-05-26 16:47:27.716285+07:00
KH-00618,HỘ KINH DOANH ĐÔNG NAM,103230684,"xã An Châu, Tỉnh Nghệ An",29,STANDARD,True,2026-05-26 16:47:27.716285+07:00,2026-05-26 16:47:27.716285+07:00
KH-00619,CỬA HÀNG XE ĐẠP VĨNH PHÁT,288609649,"Phan Triêm, Phường Hòa Xuân, TP Đà Nẵng",47,STANDARD,True,2026-05-26 16:47:27.716285+07:00,2026-05-26 16:47:27.716285+07:00
KH-00620,CỬA HÀNG XE ĐẠP ĐẠI DƯƠNG,269183876,"phố Đồng Phú, Xã Kỳ Anh, Hà Tĩnh",12,STANDARD,True,2026-05-26 16:47:27.716285+07:00,2026-05-26 16:47:27.716285+07:00
KH-00621,CÔNG TY TNHH SƠN HÀ,273225623,"TTTM chợ Đồng Than, Xã Hoàn Long, Tỉnh Hưng Yên",14,STANDARD,True,2026-05-26 16:47:27.716285+07:00,2026-05-26 16:47:27.716285+07:00
KH-00622,CÔNG TY CỔ PHẦN XUÂN MAI,266529710,"đường Hoàng Quốc Việt, tổ 2, Bắc Lệnh, Phường Cam Đường, Lào Cai",24,STANDARD,True,2026-05-26 16:47:27.716285+07:00,2026-05-26 16:47:27.716285+07:00
KH-00623,CÔNG TY TNHH THƯƠNG MẠI ĐẠI LỢI,102062325,"SN;231 tổ 32 khu 4A, Phường Cửa Ông, Quảng Ninh",38,STANDARD,True,2026-05-26 16:47:27.716285+07:00,2026-05-26 16:47:27.716285+07:00
KH-00624,CÔNG TY TNHH THƯƠNG MẠI HÙNG CƯỜNG,191638308,"Khu Lạch Đồng Giếng, Thôn Quyết Tiến, Xã Trần Phú, TP Hà Nội",11,STANDARD,True,2026-05-26 16:47:27.716285+07:00,2026-05-26 16:47:27.716285+07:00
KH-00625,CÔNG TY TNHH MINH PHƯƠNG,226039129,"Xã Hồng Vân, TP Hà Nội",11,STANDARD,True,2026-05-26 16:47:27.716285+07:00,2026-05-26 16:47:27.716285+07:00
KH-00626,CÔNG TY TNHH AN PHÁT,204411093,"TT Liễu Đề, Xã Nghĩa Hưng, Ninh Bình",30,STANDARD,True,2026-05-26 16:47:27.716285+07:00,2026-05-26 16:47:27.716285+07:00
KH-00627,CÔNG TY CỔ PHẦN KHẢI HOÀN,130729984,"Phan Kế Bính, Phường Giảng Võ, TP Hà Nội",11,STANDARD,True,2026-05-26 16:47:27.716285+07:00,2026-05-26 16:47:27.716285+07:00
KH-00628,CỬA HÀNG XE ĐẠP PHÚ THỊNH,224507573,"Xã Quỳnh Lưu, Xã Quỳnh Lưu, Tỉnh Ninh Bình",30,STANDARD,True,2026-05-26 16:47:27.716285+07:00,2026-05-26 16:47:27.716285+07:00
KH-00629,CÔNG TY TNHH ĐÔNG NAM,214016268,"Xã Lý Nhân, Ninh Bình",30,STANDARD,True,2026-05-26 16:47:27.716285+07:00,2026-05-26 16:47:27.716285+07:00
KH-00630,CÔNG TY TNHH THƯƠNG MẠI ĐẠI DƯƠNG,165591149,"phố Vũ Xuân Thiều, Phường Phúc Lợi, Thành phố Hà Nội",11,STANDARD,True,2026-05-26 16:47:27.716285+07:00,2026-05-26 16:47:27.716285+07:00
KH-00631,CÔNG TY TNHH VIỆT ANH,256599219,"Đường Chợ Bún, Xã Bát Tràng, TP Hà Nội",11,STANDARD,True,2026-05-26 16:47:27.716285+07:00,2026-05-26 16:47:27.716285+07:00
KH-00632,CỬA HÀNG XE ĐẠP LONG PHÚ,264237748,"Xã Quang Trung, Bắc Ninh",3,STANDARD,True,2026-05-26 16:47:27.716285+07:00,2026-05-26 16:47:27.716285+07:00
KH-00633,DOANH NGHIỆP TW KHẢI HOÀN,157332000,"Xã Ngọc Lý, Huyện Tân Yên, Bắc Giang",1,STANDARD,True,2026-05-26 16:47:27.716285+07:00,2026-05-26 16:47:27.716285+07:00
